District,Representative,Party,Prior experience,Education,Assumed Office,Born In,Alabama 1,Bradley Byrne,,Republican,"Alabama Senate, Alabama State Board of Education",Duke University,,University of Alabama,2013*,1955,,,,,Alabama 2,Martha Roby,,Republican,Montgomery City Council,New York University,,Cumberland School of Law,2011,1976,,,,,Alabama 3,Mike Rogers,,Republican,"Calhoun County Commissioner, Alabama House of Representatives",Jacksonville State University,,Birmingham School of Law,2003,1958,,,,,Alabama 4,Robert Aderholt,,Republican,Haleyville Municipal Judge,Birmingham–Southern College,,Samford University,1997,1965,,,,,Alabama 5,Mo Brooks",,Republican,"Alabama House of Representatives, Madison County Commissioner",Duke University,,University of Alabama,2011,1954,,,,,Alabama 6,Gary Palmer,,Republican,Policy analyst,University of Alabama,2015,1954Alabama 7,Terri Sewell",,Democratic,Attorney,Princeton University,,Harvard Law School,,,,,,,University of Oxford,2011,1965,,,,,Alaska At Large,Don Young",,Republican,"Alaska Senate, Ship captain, Mayor of Fort Yukon, Alaska","California State University, Chico",1973*,1933Arizona 1, Ann Kirkpatrick,,Democratic,"Arizona House of Representatives, U.S. House",University of Arizona,,University of Arizona College of Law,2013,1950,,,,,Arizona 2,Martha McSally,,Republican,USAF Colonel,United States Air Force Academy,2015,1966Arizona 3,Raúl Grijalva,,Democratic,Pima County Board of Supervisors,University of Arizona,2003,1948Arizona 4,Paul Gosar,,Republican,President of the Northern Arizona Dental Society,Creighton University,,Creighton University School of Dentistry,2011,1958,,,,,Arizona 5,"Matt Salmon, official portrait, 113th Congress.jpg Matt Salmon",,Republican,"Arizona Senate, U.S. House",Arizona State University,,Brigham Young University,2013,1958,,,,,Arizona 6,"David Schweikert, Official Portrait, 112th Congress 2.jpg David Schweikert",,Republican,"Arizona House of Representatives, Arizona Board of Education, Arizona Board of Equalization, Maricopa County Treasurer",Arizona State University,2011,1962Arizona 7,Ruben Gallego.jpg Ruben Gallego,,Democratic,Arizona House of Representatives,Harvard University,2015,1979Arizona 8,"Trent Franks, official portrait, 114th Congress.jpg Trent Franks",,Republican,Arizona House of Representatives,Ottawa University,2003,1957Arizona 9,Kyrsten Sinema 113th Congress.jpg Kyrsten Sinema,,Democratic,"Arizona Senate, Arizona House of Representatives",Brigham Young University,,Arizona State University,2013,1976,,,,,Arkansas 1,"Rick Crawford, Official Portrait, 112th Congress.jpg Rick Crawford",,Republican,"Broadcaster, Businessman",Arkansas State University,2011,1966Arkansas 2,French Hill official photo.jpg French Hill,,Republican,Businessman,Vanderbilt University,,UCLA Anderson School of Management,2015,1956,,,,,Arkansas 3,"Steve Womack, Official Portrait, 112th Congress - Hi Res.jpg Steve Womack",,Republican,"Mayor of Rogers, Arkansas",Arkansas Tech University,2011,1957Arkansas 4,Bruce Westerman official congressional photo.jpg Bruce Westerman,,Republican,Arkansas House of Representatives,University of Arkansas,,Yale University,2015,1956,,,,,California 1,Doug LaMalfa 113th Congress official photo.jpg Doug LaMalfa,,Republican,"California State Senate, California State Assembly",California Polytechnic State University,2013,1960California 2,"Jared Huffman, Official portrait, 113th Congress.jpg Jared Huffman",,Democratic,California State Assembly,"University of California, Santa Barbara",,Boston College Law School,2013,1964,,,,,California 3,John Garamendi 113th Congress.jpg John Garamendi,,Democratic,"Lieutenant Governor of California, United States Deputy Secretary of the Interior, California Insurance Commissioner, California State Senate, California State Assembly","University of California, Berkeley",,Harvard Business School,2009*,1945,,,,,California 4,"Tom McClintock, Official Portrait.JPG Tom McClintock",,Republican,"California Senate, California State Assembly","University of California, Los Angeles",2009,1956California 5,Mike Thompson.jpg Mike Thompson,,Democratic,California State Senate,"California State University, Chico",1999,1951California 6,Doris Matsui Official Photo.JPG Doris Matsui,,Democratic,"Sacramento, California City Council","University of California, Berkeley",2005*,1944California 7,Ami Bera official photo.jpg Ami Bera,,Democratic,"Chief Medical Officer of Sacramento County, California","University of California, Irvine",2013,1965California 8,"Paul Cook, official portrait, 113th Congress.jpg Paul Cook",,Republican,California State Assembly,Southern Connecticut State University,,"California State University, San Bernardino",,,,,,,"University of California, Riverside",2013,1943,,,,,California 9,Mcnerney113.jpg Jerry McNerney,,Democratic,Engineering executive,University of New Mexico,2007,1951California 10,Jeff Denham Official Portrait.jpg Jeff Denham,,Republican,California State Senate,California Polytechnic State University,2011,1967California 11,Mark DeSaulnier-1.jpeg Mark DeSaulnier,,Democratic,"California State Senate, California State Assembly, Contra Costa County Board of Supervisors",College of the Holy Cross,2015,1952California 12,Speaker Nancy Pelosi.jpg Nancy Pelosi,,Democratic,Current House Minority Leader,,,Northern California Democratic Party Chairwoman,Trinity Washington University,1987*,1940,,,,California 13,Barbaralee newheadshot 1200.jpg Barbara Lee,,Democratic,California State Assembly,Mills College,,"University of California, Berkeley",1998*,1946,,,,,California 14,"Jackie Speier, official photo portrait, 111th Congress.jpg Jackie Speier",,Democratic,"California State Senate, California State Assembly, San Mateo County Board of Supervisors","University of California, Davis",,"UC, Hastings Law",2008*,1950,,,,,California 15,"Eric Swalwell, official portrait, 114th Congress.jpg Eric Swalwell",,Democratic,Dublin City Council,"University of Maryland, College Park",,University of Maryland School of Law,2013,1980,,,,,California 16,Jimcosta.jpeg Jim Costa,,Democratic,"California State Senate, California State Assembly","California State University, Fresno",2005,1952California 17,Mike honda.jpg Mike Honda,,Democratic,"California State Assembly, Santa Clara County Board of Supervisors",San Jose State University,2001,1941California 18,Rep Anna Eshoo.jpg Anna Eshoo,,Democratic,San Mateo County Board of Supervisors,Cañada College,,Menlo College,1993,1942,,,,,California 19,"Zoe Lofgren, Official Portrait, 112th Congress.jpg Zoe Lofgren",,Democratic,Santa Clara County Board of Supervisors,Stanford University,,Santa Clara University,1995,1947,,,,,California 20,Farr-Portrait-2013.jpg Sam Farr,,Democratic,"California State Assembly, Monterey County Board of Supervisors",Willamette University,,Santa Clara University,,,,,,,Monterey Institute of International Studies,1993*,1941,,,,,California 21,"David Valadao, official portrait, 113th Congress.jpg David Valadao",,Republican,California State Assembly,College of the Sequoias,2013,1977California 22,"Devin Nunes, official color photo portrait.jpg Devin Nunes",,Republican,California State Director for the United States Department of Agriculture's Rural Development Section,College of the Sequoias,,"Cal Poly University, San Luis Obispo",2003,1973,,,,,California 23,Kevin McCarthy2.jpg Kevin McCarthy,,Republican,Current House Majority Leader,,,California State Assembly,"California State University, Bakersfield",2007,1965,,,,California 24,Lois Capps.jpg Lois Capps,,Democratic,"Nurse, Teacher",Pacific Lutheran University,,Yale University,,,,,,,"University of California, Santa Barbara",1998*,1938,,,,,California 25,Steve Knight official congressional photo.jpeg Steve Knight,,Republican,"California State Senate, California State Assembly, Palmdale City Council",Antelope Valley College,2015,1966California 26,Julia Brownley 113th Congress official photo.jpg Julia Brownley,,Democratic,California State Assembly,George Washington University,,American University,2013,1952,,,,,California 27,"Judy Chu, official photo.jpg Judy Chu",,Democratic,"Mayor of Monterey Park, Monterey Park City Council, California State Assembly, California State Board of Equalization","University of California, Los Angeles",2009*,1953California 28,"Adam Schiff, official photo portrait, 111th Congress.jpg Adam Schiff",,Democratic,"California State Senate, Assistant Prosecutor for the United States Attorney for the Southern District of California",Stanford University,,Harvard University,2001,1960,,,,,California 29,U.S. Rep. Tony Cárdenas.jpg Tony Cárdenas,,Democratic,Los Angeles City Council,"University of California, Santa Barbara",2013,1963California 30,Brad Sherman Official.jpg Brad Sherman,,Democratic,California Board of Equalization,"University of California, Los Angeles",,Harvard Law School,1997,1954,,,,,California 31,Pete Aguilar official portrait 114th Congress.jpg Pete Aguilar,,Democratic,Mayor of Redlands,University of Redlands,2015,1979California 32,Rep-Napolitano.jpg Grace Napolitano,,Democratic,California State Assembly,Texas Southmost College,1999,1936California 33,Rep Ted Lieu.jpg Ted Lieu,,Democratic,"California State Senate, California State Assembly",Stanford University,,Georgetown University,2015,1969,,,,,California 34,"Xavier Becerra, Official Portrait.JPG Xavier Becerra",,Democratic,California State Assembly,Stanford University,1993,1958California 35,Norma Torres official portrait.jpg Norma Torres,,Democratic,"California State Senate, California State Assembly, Mayor of Pomona",National Labor College,2015,1965California 36,"Raul Ruiz, official portrait, 113th congress.jpg Raul Ruiz",,Democratic,Emergency physician,"University of California, Los Angeles",,Harvard University,2013,1972,,,,,California 37,Karen-Bass-2012.jpg Karen Bass,,Democratic,Speaker of the California State Assembly,"California State University, Dominguez Hills",2011,1953California 38,Linda Sanchez Official.jpg Linda Sánchez,,Democratic,Attorney,"University of California, Berkeley",,"University of California, Los Angeles",2003,1969,,,,,California 39,"Edward Royce, official photo portrait color.jpg Ed Royce",,Republican,California State Senate,"California State University, Fullerton",1993,1951California 40,Lucille roybal.jpg Lucille Roybal-Allard,,Democratic,public relations executive,"California State University, Los Angeles",1993,1941California 41,Mark Takano 113th Congress official photo.jpg Mark Takano,,Democratic,Teacher,Harvard University,2013,1960California 42,Ken Calvert Portrait.jpg Ken Calvert,,Republican,Real Estate Executive,Chaffey College,,San Diego State University,1993,1953,,,,,California 43,Maxine Waters Official.jpg Maxine Waters,,Democratic,California State Assembly,"California State University, Los Angeles",1991,1938California 44,"Janice Hahn, official portrait, 112th Congress.jpg Janice Hahn",,Democratic,"Los Angeles City Council, former businesswoman and teacher",Abilene Christian University,2011*,1952California 45,Mimi Walters official congressional photo 2.jpg Mimi Walters,,Republican,"California State Senate, California State Assembly, Mayor of Laguna Niguel","University of California, Los Angeles",2015,1962California 46,Loretta Sanchez official photo.jpg Loretta Sanchez,,Democratic,Financial analyst,Chapman University,,American University,1997,1960,,,,,California 47,Alan Lowenthal 113th Congress Portrait.jpeg Alan Lowenthal,,Democratic,"California State Senate, California State Assembly",Ohio State University|,,Hobart College,2013,1941,,,,,California 48,Dana Rohrabacher.jpg Dana Rohrabacher,,Republican,Special assistant to President Reagan,"California State University, Long Beach",,University of Southern California,1989,1947,,,,,California 49,Congressman Darrell Issa.jpg Darrell Issa,,Republican,Electronics executive,Kent State University,2001,1953California 50,"Duncan D. Hunter, official photo portrait, 111th Congress.jpg Duncan D. Hunter",,Republican,"Military officer, businessman",San Diego State University,2009,1976California 51,Juan Vargas official photo.jpg Juan Vargas,,Democratic,"California State Senate, California State Assembly, San Diego City Council",Harvard Law School,,Fordham University,,,,,,,University of San Diego,2013,1961,,,,,California 52,Scott Peter's Official 113th Congressional Portrait.jpg Scott Peters,,Democratic,"San Diego City Council, San Diego Port Commission",Duke University,,New York University School of Law,2013,1958,,,,,California 53,Susan Davis Cropped.jpg Susan Davis,,Democratic,"California State Assembly, San Diego School Board","University of California, Berkeley",,University of North Carolina at Chapel Hill,2001,1944,,,,,Colorado 1,"Diana DeGette, official Congressional photo.JPG Diana DeGette",,Democratic,Colorado House of Representatives,Colorado College,1997,1957Colorado 2,Jared Polis Official 2012.jpg Jared Polis,,Democratic,"Colorado State Board of Education, Internet Executive",Princeton University,2009,1975Colorado 3,"Scott Tipton, Official Portrait, 112th Congress.JPG Scott Tipton",,Republican,Colorado House of Representatives,Fort Lewis College,2011,1956Colorado 4,Ken Buck official congressional photo.jpg Ken Buck,,Republican,"Weld County District Attorney, Prosecutor U.S. Attorney's Office","Princeton University, University of Wyoming",2015,1959Colorado 5,Doug Lamborn official portrait.jpg Doug Lamborn,,Republican,"President pro tempore of the Colorado Senate, Colorado House of Representatives",University of Kansas,2007,1954Colorado 6,Mike Coffman.jpg Mike Coffman,,Republican,"Secretary of State of Colorado, Colorado State Treasurer, Colorado Senate, Colorado House of Representatives",University of Colorado,2009,1955Colorado 7,Ed Perlmutter 113th Congress.jpg Ed Perlmutter,,Democratic,Colorado Senate,University of Colorado,2007,1953Connecticut 1,"John B Larson, Official Portrait, circa 111 - 112th Congress.jpg John B. Larson",,Democratic,"Connecticut Senate, East Hartford, Connecticut City Council, East Hartford, Connecticut Board of Education",Central Connecticut State University,1999,1948Connecticut 2,"Joe Courtney, official 110th Congress photo portrait.jpg Joe Courtney",,Democratic,Connecticut House of Representatives,Tufts University,2007,1953Connecticut 3,Rosa DeLauro Portrait.jpg Rosa DeLauro,,Democratic,"Executive Director of EMILY's List, Political aide",Marymount College,1991,1943Connecticut 4,Jim Himes Official.jpg Jim Himes,,Democratic,"Financial executive, Greenwich Housing Authority Board",Harvard University,,University of Oxford,2009,1966,,,,,Connecticut 5,Esty-official-portrait-114.jpg Elizabeth Esty,,Democratic,Connecticut House of Representatives,Harvard University,,Yale University,2013,1959,,,,,Delaware At Large,John C. Carney Jr. official portrait 112th Congress.jpg John Carney,,Democratic,"Lieutenant Governor of Delaware, Delaware Secretary of Finance",Dartmouth College,,University of Delaware,2011,1956,,,,,Florida 1,Jeff Miller Congress.JPG Jeff Miller,,Republican,"Florida House of Representatives, Santa Rosa County, Florida Deputy Sheriff",University of Florida,2001,1959Florida 2,Official Congressional Portrait of Gwen Graham (FL-02).jpg Gwen Graham,,Democratic,"Attorney, Leon County School Administrator",University of North Carolina at Chapel Hill,,Washington College of Law,2015,1963,,,,,Florida 3,"Ted Yoho, official portrait, 113th Congress.jpg Ted Yoho",,Republican,Veterinarian,University of Florida,2013,1955Florida 4,AnderCrenshaw Official Head Shot - 2009.jpg Ander Crenshaw,,Republican,"Florida Senate, Florida House of Representatives",University of Georgia,,University of Florida,2001,1944,,,,,Florida 5,Corrinebrown.jpeg Corrine Brown,,Democratic,Florida House of Representatives,Florida A&M University,1993,1946Florida 6,"Ron DeSantis, Official Portrait, 113th Congress.jpg Ron DeSantis",,Republican,"Prosecutor U.S. Attorney's Office, U.S. Navy",Yale University,,Harvard Law School,2013,1978,,,,,Florida 7,John Mica Portrait.jpg John Mica,,Republican,Florida House of Representatives,University of Florida,1993,1943Florida 8,Bill Posey.jpg Bill Posey,,Republican,"Florida Senate, Florida House of Representatives, Rockledge, Florida City Council",Nova Southeastern University,2009,1947Florida 9,Alan Grayson high res.jpg Alan Grayson,,Democratic,U.S. House,Harvard University,2013,1958Florida 10,"Daniel Webster, Official Portrait, 112th Congress.jpg Daniel Webster",,Republican,"Florida Senate, Speaker of the Florida House of Representatives",Georgia Institute of Technology,2011,1949Florida 11,"Rich Nugent, Official Portrait, 112th Congress 2.jpg Rich Nugent",,Republican,"Sheriff of Hernando County, Florida",Saint Leo University,,Troy University,2011,1951,,,,,Florida 12,Gusbilirakis.jpeg Gus Bilirakis,,Republican,Florida House of Representatives,University of Florida,,Stetson University College of Law,2007,1963,,,,,Florida 13,David Jolly.jpg David Jolly,,Republican,"Attorney, general counsel to former Congressman Bill Young",Emory University,,George Mason University School of Law,2014*,1972,,,,,Florida 14,Kathy castor.png Kathy Castor,,Democratic,"Assistant General Counsel to the Florida Department of Community Affairs, President of the Florida Association of Women Lawyers, Hillsborough County, Florida Board of Commissioners",Emory University,2007,1966Florida 15,Dennis-Ross.jpg Dennis Ross,,Republican,Florida House of Representatives,Auburn University,,Cumberland School of Law,2011,1959,,,,,Florida 16,Vern Buchanan Official.jpg Vern Buchanan,,Republican,Auto Dealer,Cleary University,2007,1951Florida 17,Tom Rooney.jpg Tom Rooney,,Republican,"Criminal Prosecutor Florida Department of Justice, Attorney",Washington & Jefferson College,,University of Florida,2009,1970,,,,,Florida 18,"Patrick Murphy, official portrait, 114th Congress.jpg Patrick Murphy",,Democratic,Accountant,University of Miami,2013,1983Florida 19,Curt Clawson official congressional photo.jpg Curt Clawson,,Republican,Automotive Executive,Purdue University,,Harvard Business School,2014*,1959,,,,,Florida 20,Alcee Hastings Portrait c111-112th Congress.jpg Alcee Hastings,,Democratic,Judge of the United States District Court for the Southern District of Florida,Fisk University,1993,1936Florida 21,TedDeutsch2016.jpg Ted Deutch,,Democratic,Florida Senate,University of Michigan,,University of Michigan Law School,2010*,1966,,,,,Florida 22,"Lois Frankel, Official portrait, 113th Congress.jpg Lois Frankel",,Democratic,"Mayor of West Palm Beach, Florida House of Representatives",Boston University,,Georgetown University Law Center,2013,1948,,,,,Florida 23,DWS cropped.jpg Debbie Wasserman Schultz,,Democratic,"Florida Senate, Florida House of Representatives",University of Florida,2005,1966Florida 24,Frederica Wilson official House portrait.jpg Frederica Wilson,,Democratic,"Florida Senate, Florida House of Representatives, Miami-Dade County Public Schools Board",Fisk University,,University of Miami,2011,1942,,,,,Florida 25,Mario Diaz-Ballart Official.jpg Mario Díaz-Balart,,Republican,"Florida Senate, Florida House of Representatives",University of South Florida,2003,1961Florida 26,CarlosC114.jpg Carlos Curbelo,,Republican,"Public administrator, Miami-Dade County Public Schools Board",University of Miami,2015,1980Florida 27,Ileana Ros-Lehtinen.jpg Ileana Ros-Lehtinen,,Republican,"Florida Senate, Florida House of Representatives",Florida International University,,University of Miami,1989*,1952,,,,,Georgia 1,"Buddy Carter, Official Portrait, 114th Congress.jpg Buddy Carter",,Republican,"Georgia State Senate, Georgia House of Representatives, Mayor of Pooler",Young Harris College,,University of Georgia,2015,1957,,,,,Georgia 2,Sanfordbishop.jpeg Sanford Bishop,,Democratic,"Georgia State Senate, Georgia House of Representatives",Morehouse College,1993,1947Georgia 3,Lynn Westmoreland Official.jpg Lynn Westmoreland,,Republican,Georgia House of Representatives,Georgia State University,2003,1950Georgia 4,Hank Johnson Official.jpg Hank Johnson,,Democratic,"DeKalb County, Georgia Commissioner, Associate Magistrate Judge",Clark Atlanta University,2007,1954Georgia 5,John Lewis-2006 (cropped).jpg John Lewis,,Democratic,"Atlanta City Council, Chairman of the Student Nonviolent Coordinating Committee",American Baptist Theological Seminary,1987,1940Georgia 6,Tom Price.jpg Tom Price,,Republican,"Physician, Georgia State Senate",University of Michigan,2005,1954Georgia 7,"Rob Woodall, Official Portrait, 112th Congress 2.jpg Rob Woodall",,Republican,"Political aide, Attorney",Furman University,,University of Georgia,2011,1970,,,,,Georgia 8,"Austin Scott, Official Portrait, 112th Congress.jpg Austin Scott",,Republican,Georgia House of Representatives,University of Georgia,2011,1969Georgia 9,Doug Collins official congressional photo.jpg Doug Collins,,Republican,Georgia House of Representatives,North Georgia College,,New Orleans Baptist Theological Seminary,2013,1966,,,,,Georgia 10,Jody Hice official portrait.jpg Jody Hice,,Republican,"Radio show host, Southern Baptist pastor",Asbury University,,Southwestern Baptist Theological Seminary,,,,,,,Luther Rice Seminary,2015,1960,,,,,Georgia 11,Barry Loudermilk official photo.jpg Barry Loudermilk,,Republican,"Georgia State Senate, Georgia House of Representatives",U.S. Air Force Community College,,Wayland Baptist University,2015,1963,,,,,Georgia 12,"Rick Allen Official Photo, 114th Congress.jpg Rick W. Allen",,Republican,Businessman,Auburn University,2015,1951Georgia 13,David Scott congressional portrait.jpg David Scott,,Democratic,"Georgia State Senate, Georgia House of Representatives",Florida A&M University,2003,1946Georgia 14,Tom Graves Official Portrait.jpg Tom Graves,,Republican,"Georgia House of Representatives,",University of Georgia,2010*,1970Hawaii 1,Colleen Hanabusa Official Photo.jpg Colleen Hanabusa,,Democratic,Hawaii Senate,University of Hawaii at Manoa,2016,1951Hawaii 2,"Tulsi Gabbard, official portrait, 113th Congress.jpg Tulsi Gabbard",,Democratic,"Honolulu City Council, Hawaii House of Representatives",Hawaii Pacific University,,Officer Candidate School,2013,1981,,,,,Idaho 1,"Raúl Labrador, Official Portrait, 112th Congress.jpg Raúl Labrador",,Republican,Idaho House of Representatives,Brigham Young University,,University of Washington,2011,1967,,,,,Idaho 2,"Mike Simpson, official Congressional photo portrait.jpg Mike Simpson",,Republican,"Speaker of the Idaho House of Representatives, Blackfoot, Idaho City Council",Utah State University,1999,1950Illinois 1,Bobby Rush 113th Congress.jpg Bobby Rush,,Democratic,Chicago City Council,Roosevelt University,,University of Illinois,,,,,,,McCormick Theological Seminary,1993,1946,,,,,Illinois 2,"Robin Kelly, 113th Congress.png Robin Kelly",,Democratic,"Illinois House of Representatives, Chief of Staff to the Illinois Treasurer, Chief Administrative Officer to the Cook County President",Bradley University,,Northern Illinois University,2013*,1956,,,,,Illinois 3,Dan lipinski lg.JPG Dan Lipinski,,Democratic,Member of the University of Notre Dame and University of Tennessee Faculty,Northwestern University,,Stanford University,,,,,,,Duke University,2005,1966,,,,,Illinois 4,LVGOfficialPhotoPortrait.jpg Luis Gutiérrez,,Democratic,Chicago City Council,Northeastern Illinois University,1993,1953Illinois 5,Mikequigley.jpeg Mike Quigley,,Democratic,Cook County Board of Commissioners,Roosevelt University,,Loyola University Chicago School of Law,,,,,,,University of Chicago,2009*,1959,,,,,Illinois 6,Peter J. Roskam 113th Congress.jpg Peter Roskam,,Republican,"Illinois Senate, Illinois House of Representatives",University of Illinois,,Chicago–Kent College of Law,2007,1961,,,,,Illinois 7,DannyKDavis113th.jpg Danny K. Davis,,Democratic,"Chicago City Council, Cook County Board of Commissioners",University of Arkansas at Pine Bluff,,Chicago State University,,,,,,,Union Institute and University,1997,1941,,,,,Illinois 8,"Tammy Duckworth, official portrait, 113th Congress.jpg Tammy Duckworth",,Democratic,Assistant Secretary of the Department of Veterans Affairs for Public and Intergovernmental Affairs,University of Hawai_i at M_noa,,George Washington University,,,,,,,Northern Illinois University,2013,1968,,,,,Illinois 9,Janschakowskyemailsmall.jpg Jan Schakowsky,,Democratic,Illinois House of Representatives,University of Illinois,1999,1944Illinois 10,Robert Dold official portrait 114th Congress.jpg Robert Dold,,Republican,U.S. House,Denison University,,Indiana University,,,,,,,Kellogg School of Management,2015,1969,,,,,Illinois 11,"Bill Foster, Official Portrait, 113th Congress.jpg Bill Foster",,Democratic,U.S. House,University of Wisconsin–Madison,,Harvard University,2013,1955,,,,,Illinois 12,Mike Bost official photo.jpg Mike Bost,,Republican,Illinois House of Representatives,University of Illinois,2015,1960Illinois 13,"Rodney Davis, Official Portrait, 113th Congress.jpg Rodney Davis",,Republican,Congressional Staffer,Millikin University,2013,1970Illinois 14,Randy Hultgren Official Photo 112.jpg Randy Hultgren,,Republican,"Illinois Senate, Illinois House of Representatives, DuPage County, Illinois Board of Commissioners",Bethel University,,Chicago-Kent College of Law,2011,1966,,,,,Illinois 15,Johnshik.jpg John Shimkus,,Republican,"Madison County, Illinois Treasurer",United States Military Academy,,Southern Illinois University,1997,1958,,,,,Illinois 16,Adam Kinzinger official congressional photo.jpg Adam Kinzinger,,Republican,"McLean County, Illinois Board of Commissioners",Illinois State University,2011,1978Illinois 17,Bustos-IL17-pic.jpg Cheri Bustos,,Democratic,East Moline City Council,University of Maryland,,University of Illinois at Springfield,2013,1961,,,,,